{
  "schemaVersion": 2,
  "sourceHash": "sha256:1cc8e03f3084263c24d78344fd23aa9a08e540e7952f90f9cf383f819128d203",
  "currency": "CNY",
  "peakPolicy": {
    "timezone": "Asia/Shanghai",
    "weekdaysOnly": true,
    "windows": [
      {
        "start": "09:00",
        "end": "12:00"
      },
      {
        "start": "14:00",
        "end": "18:00"
      }
    ],
    "holidayCalendar": {
      "coveredFrom": "2026-01-01",
      "coveredThrough": "2026-12-31",
      "excludedDates": [
        "2026-01-01",
        "2026-01-02",
        "2026-01-03",
        "2026-02-15",
        "2026-02-16",
        "2026-02-17",
        "2026-02-18",
        "2026-02-19",
        "2026-02-20",
        "2026-02-21",
        "2026-02-22",
        "2026-02-23",
        "2026-04-04",
        "2026-04-05",
        "2026-04-06",
        "2026-05-01",
        "2026-05-02",
        "2026-05-03",
        "2026-05-04",
        "2026-05-05",
        "2026-06-19",
        "2026-06-20",
        "2026-06-21",
        "2026-09-25",
        "2026-09-26",
        "2026-09-27",
        "2026-10-01",
        "2026-10-02",
        "2026-10-03",
        "2026-10-04",
        "2026-10-05",
        "2026-10-06",
        "2026-10-07"
      ]
    }
  },
  "models": [
    {
      "modelId": "deepseek-flash",
      "displayName": "Flash",
      "peak": {
        "inputCacheHit": 0.04,
        "inputCacheMiss": 2,
        "output": 8
      },
      "offPeak": {
        "inputCacheHit": 0.02,
        "inputCacheMiss": 1,
        "output": 4
      }
    },
    {
      "modelId": "deepseek-v4-pro",
      "displayName": "Pro",
      "peak": {
        "inputCacheHit": 0.3,
        "inputCacheMiss": 9,
        "output": 27
      },
      "offPeak": {
        "inputCacheHit": 0.15,
        "inputCacheMiss": 4.5,
        "output": 13.5
      }
    }
  ]
}
